https://www.nga.gov/collection/art-object-page.60.html,Vermeer  Johannes  1632-1675,Girl with a Red Hat,Attributed to Vermeer,"Seymour 1964, pp. 326-28; Gowing 1970, pp. 146, 147 n. 120; Blankert 1978, p. 172, no. B3; Slatkes 1981, p. 97; Wheelock 1981, p. 130; Wheelock 1995a, ch. 12; Wheelock 1995b, pp. 382-87; Washington and The Hague 1995-96, no. 14.; Liedtke 2000, pp. 242-45; New York and London 2001, no. 74",,"Burger 47; HdG 46A; De Vries 22: 1664; Bloch, ill. 56; Goldscheider 25: 1667","Th. B. sous no. 47; HdG. no. 46a; Pl. no. 38; Tancred Borenius, The new Vermeer, in: Apollo, II, 1925, p. 125-126; C.R. Grundy, the new discovered Vermeer, in: The Conoisseur, LXXIII, 1925, p. 116-119; P. Lavallee, Un tableau inconnu de Vermeer, in: La Revue de l'Art ancien et moderne, XLVII, 1925, p. 323-324; The Art News, XXIII, 1924-1925, no. 40; Emil Waldmann, Ein neues Bild von Jan Vermeer van Delft, in: Kunst und Kunstler, XXIV, 1926, p. 174 et 186-187; Pantheon, I, 1928, p. 270-272","Th. B. onder no. 47; T. Borenius, The new Vermeer, ApolloII, 1925, p. 125-26; C.R. Grundy, The new-discovered Vermeer, Connoisseur, 1925, p. 116-19; P. Lavallee, Un tableau inconnu de Vermeer, Rev. Art. Anc., 1925, p. 323-24; E. Waldmann, Ein neues Bild von jan Bermeer van Delft, Kunst und Kunstler, 1926, p. 174, 186-87",,,,,
https://www.nga.gov/collection/art-object-page.1237.html,Vermeer  Johannes  1632-1675,Young Girl with a Flute,Attributed to Vermeer,"Gowing 1970, p. 146; Blankert 1978, pp. 73-74, 172, no. B4; Slatkes 1981, p. 98; Wheelock 1981, p. 156; Wheelock 1995b, pp. 387-93; Washington and The Hague 195-96, no. 23; Liedtke 2000, pp. 244-45",,"HdG 22 d; De Vries: 1664; Bloch, ill. 57; Goldscheider 26: 1667","HdG. no. 22; Pl. no. 39; Abraham Bredius, Der 36. (oder 37.?) Delfter Vermeer, in: Kunstchronik, n.s., XVIII, 1906-07, col. 385-386; Kurt Freise, Der neue Vermeer, in: Z.F.B.K., n.s., XVIII, 1907, p. 277-278; Theodor von Frimmel, in: Blatter fur Gemaldekunde, III, 1907, p. 198 et IV, 1908 p. 27; Wilhelm Martin, Jan Vermeer van Delft, Het Jeisje met de fluit, in: Onze Kunst, VI, 1907, no. 3, p. 20-24; Wilhelm Martin, La Jeune Fille a la flute de Vermeer de Delft, in: L'Art flamand et hollandais, VIII, 1907, p. 20-23; R.R. Tatlock, Vermeer's ""Girl with a flute,"" in: B.M., XXXIX, 1921, p. 28-33","H.d.G. no. 22d; Pl. no. 13; A. Bredius, Der 36 (oder 37?) Delfter Vermeer, Kunstchr. NF., XVIII, 1907, p. 385-86; K. Freise, Der neue Vermeer, Zeitschr. F. Bild. K., 1907, p. 277-78; W. Martin, Jan Vermeer van Delft, Het meisje met de fluit, Onze Kunst, 1907, p. 20-24; Idem, Art flam., 1907, p. 20-23; R.R. Tatlock, Vermeer's Girl with a flute, Burl. Mag. 1921, p. 28-33",,,,,
https://www.khm.at/en/objectdb/detail/2574/?offset=0&lv=list,Vermeer  Johannes  1632-1675,The Art of Painting,Attributed to Vermeer,"Gowing 1970, pp. 139-44; Blankert 1978, pp. 46-49 and no. 19; Slatkes 1981, pp. 77-78; Wheelock 1981, pp. 2, 128; Nash 1991, pp. 119-26; Asemissen 1993; Arasse 1994, pp. 40-58; Wheelock 1995a, ch. 13; Hertel 1996, pp. 167-70, 176-86, 200-204; Miedema 1998; Sluijter 1998; Liedtke 2000, pp. 247-51; New York and London 2001, no. 76",,Burger 5; HdG 8; De Vries 23: 1665; Bloch: 1665-70; Goldscheider 24: 1666,"Th. B. no. 5; H. no. 5; HdG. no. 8; Pl. no. 4; Karl Wilczek, Katalog der Graf Czerninschen Gemaldegalerie in Wein, Wien 1936, no. 117",Th. B. no. 5; H. no. 5; H.d.G. no. 8; Pl. no. 37,"Hale cites writing dated 1866 by Professor G.F. Waagen, Director of the Royal Gallery of Paintings in Berlin; Thore-Burger, Theophile, ""Van der Meer de Delft,"" in Gazette des Beaux-Arts 21 (October-December 1866)",H.d.G. 8,"B. 5; H. 5; Groot cites Waagen, iii. 27.",,"Gallery of Count Czernin, Vienna(as Pieter de Hooch) ; M. Waagen, Manuel, t. III, p. 27; Louis Viardot, Musées d'Allemagne, (New Edition) 1860, p. 244"
https://sammlung.staedelmuseum.de/en/work/the-geographer,Vermeer  Johannes  1632-1675,The Geographer,Attributed to Vermeer,"Gowing 1970, pp. 148-51; Welu 1975, pp. 543-47; Blankert 1978, p. 55 and no. 24; Slatkes 1981, pp. 85-86; Wheelock 1981, pp. 13, 136-38; Welu 1986; Nash 1991, pp. 104, 106; Washington and The Hague 1995-96, pp. 41, 53 and no. 16; Frankfurt 1997; Liedtke 2000, pp. 262-63, 295 nn. 276-88; Van Berkel 2001, pp. 138-39; New York and London 2001, p. 167",,Burger 34; HdG 5; De Bries 28: 1669; Bloch: 1668 [sic!]; Goldscheider 28: 1669,"Th. B. no. 34; H. no 37; HdG. no. 5; Pl. no. 7; Paul Mantz, Le Cabinet de M.A. Dumont a Cambrai, in: G.d.B.-A, 1860, II, p. 303-305 ",Th. B. no. 34; H. no. 37; H.d.G. no. 5; Pl. no. 17,"Dobell, Clifford, F.R.S., Antony van Leeuwenhoek and His ""Little Animals,"" London and New York, 1932",Hale cites M. Vanzype,"B. 34; H. 37; Stadel'sches Kunstinstitut, Frankfort-on-Main, 1900 catalogue, No. 217",,"Paul Mantz, Gazette, t. VIII, p. 304; l'Histoire des peintres, engraving"
https://upload.wikimedia.org/wikipedia/commons/0/0e/Johannes_Vermeer_-_The_Astronomer_-_WGA24685.jpg,Vermeer  Johannes  1632-1675,The Astronomer,Attributed to Vermeer,"Gowing 1970, pp. 147-51; Welu 1975, pp. 544-47; Blankert 1978, p. 55 and no. 23; Slatkes 1981, p. 82; Wheelock 1981, pp. 13, 136-38; Welu 1986; Nash 1991, pp. 104, 106; Washington and The Hague 1995-96, pp. 41, 53, 172, 174; Frankfurt 1997; Liedtke 2000, pp. 262-63, 295 nn. 276-88; New York and London 2001, p. 167",,Burger 36; HdG 6; De Bries 27: 1668; Bloch: 1688; Goldscheider 27: 1668,"Th. B. no. 36; H. no. 39; HdG. No. 6; Pl. no. 8; W. Burger(-Thore), Nouvelles Etudes sur la Galerie Suermondt, in: G.d.B.-A., 1869, I, p. 171",Th. B. no 36; H. no. 29; H.d.G no. 6; Pl. no. 33,,,B. 36; H. 39,,Personal letter by M. Mundler 
https://www.louvre.fr/en/oeuvre-notices/lacemaker,Vermeer  Johannes  1632-1675,The Lacemaker,Attributed to Vermeer,"Gowing 1970, pp. 144-45; Blankert 1978, no. 26; Slatkes 1981, p. 94; Wheelock 1981, p. 144; Nash 1991, pp. 31, 110-13; Blankert and Grijp 1995; Washington and The Hague 1995-96, p. 40 and no. 17; Liedtke 2000, pp. 256-57; New York and London 2001, p. 164",,Burger 37; HdG 11; De Vries D: 1664; Bloch: 1665-70; Goldscheider 22: 1665,Th. B. no. 37; H. no. 40; HdG. no. 11; Pl. no. 10,Th. B. no 37; H. no. 40; H.d.G. no. 11; Pl. no. 32,"Hale cites Dr. Hofstede de Groot and W.R. Valentiner; Fell, H. Granville, Vermeer, London and Edinburgh, 1933",H.d.G. 11,"B. 37; H. 40; Louvre, paris, 1902 catalogue, No. 2456",,"Musées de la Hollande, par. W.B., t. II, p. 71"
"https://www.rijksmuseum.nl/en/vermeers-the-little-street-discovered/objects#/SK-A-1595,3",Vermeer  Johannes  1632-1675,The Love Letter,Attributed to Vermeer,"Gowing 1970, pp. 56-59, 152; Van Thiel 1972; Welu 1975, p. 533; Blankert 1978, pp. 53-54 and no. 22; Slatkes 1981, pp. 73-74; Wheelock 1981, pp. 140-41; Nash 1991, p. 82; Washington and The Hague 1995-96, no. 18; Liedtke 2000, pp. 111, 162-63, 252-54; Goodman 2001, pp. 76-78; Vergara 2003, pp. 56-57; Dublin and Greenwich 2003-4, no. 38bis",,HdG 32; De Vries 24: 1666; Bloch: 1665-70; Goldscheider 31: 1670,HdG. no. 32; Pl. no. 24, H.d.G. no. 32; Pl. no. 2,"Hale cites Eduard Plietzsch and an article written in ""Pantheon"" by W.R. Valentiner",H.d.G. 32,"Rijksmuseum, Amsterdam, 1905 catalogue, No. 2528",,
https://www.nationalgallery.ie/art-and-artists/highlights-collection/woman-writing-letter-her-maid-johannes-vermeer,Vermeer  Johannes  1632-1675,Lady Writing a Letter with her Maid,Attributed to Vermeer,"Gowing 1970, pp. 153-54; Blankert 1987, p. 56 and no. 27; Slatkes 1981, p. 101; Wheelock 1981, p. 146; Nash 1991, pp. 84, 86; Wheelock 1995a, ch. 16; Washington and The Hague 1995-96, p. 39 and no. 19; Vergara 1998; Liedtke 2000, pp. 254-56; Nevitt 2001, pp. 105-6; New York and London 2001, pp. 167, 168; Vergara 2003, pp. 57-58; Dublin and Greenwich 2003-4, no. 39",, HdG 35; De Vries 16: 1660-62; Bloch: 1665-70; Goldscheider 30: 1670,H. no. 44; HdG. no. 35; Pl. no. 27,H. no. 44?; H.d.G no. 35; Pl. no. 24,,,"B. 8 and 40A; H. 44; Groot cites Oud Holland, x. 231, 236; E. Sedelmeyer, ""Catalogue of 300 Paintings,"" 1898, No. 86",,"Leon Lagrange, Gazette des Beaux-Arts, 1859; Leon Lagrange, Gazette des Beaux-Arts, 1861; Marius Chaumelin, Tresors d'art de la Provence, Paris and Marseille, 1862."
https://www.metmuseum.org/art/collection/search/437877,Vermeer  Johannes  1632-1675,Allegory of Faith,Attributed to Vermeer,"Blankert 1978, no. 29; Slatkes 1981, pp. 106-9; Wheelock 1981, p. 148; Arasse 1994, pp. 17-25, 83-86, etc.; Washington and The Hague 1995-96, no. 20; Hertel 1996, pp. 205-29; Liedtke 2000, pp. 260-62; New York and London 2001, no. 77; Liedtke 2007, pp. 893-902 (with summaries of all earlier references)",,Burger 41; HdG 2; DeVries 29: 1669-70; Bloch: after 1670; Goldscheider 37: 1672,"Th.B. no. 41; H. no. 46; HdG. no. 2; Pl. no. 3; A.J. Barnouw, Vermeers zogenaamd ""Novum Testamentum,"" in: O.H., XXXII, 1914, p. 50-54","Th. B. no. 41; H. no. 46; H.d.G. no. 2; Pl. no. 20; A.J. Barnouw, Vermeers zoogenaamd ""Novum Testamentum,"" Oud-Holland, 1914, p. 50-54","""The Friedsam Collection of Paintings,"" Bulletin of the Metropolitan Museum, November, 1932",Hale cites Dr. Bredius,B. 41; H. 46,,
https://www.nationalgallery.org.uk/paintings/johannes-vermeer-a-young-woman-standing-at-a-virginal,Vermeer  Johannes  1632-1675,Young Woman Standing at a Virginal,Attributed to Vermeer,"Gowing 1970, pp. 155-57; Blankert 1978, p. 59 and no. 25; Slatkes 1981, p. 88; Wheelock 1981, p. 152; MacLaren/Brown 1991, pp. 466-68; Nash 1991, pp. 114-18; Washington and The Hague 1995-96, no. 21; Liedtke 2000, pp. 257-60, 294 nn. 252, 260; New York and London 2001, no. 78",,Burger 29; HdG 23; De Bries 30: 1670; Bloch: late; Goldscheider 35: 1671,"Th. B. no. 29; H. no. 32; HdG. no. 23; Pl. no. 15; P. Alfassa, Les Vermeers de la Galerie Nationale de Londres, in: La Revue de l'Art ancien et moderne, XX, 1911, p. 401-408; M. Rooses, in: Elsevier's geillustreerd Maandschrift, 1898, p. 352-360","Th. B. no. 29; H. no. 32; H.d.G. No. 23; Pl. no. 22; P. Alfassa, Les Vermeers de la Galerie Nationale de Londres, Rev. Art. Anc., 1911, p. 401-8; M. Rooses, Elsevier, 1898, p. 352-60","Groot, Hofstede de, A Catalogue Raisonee of the works of the Most Eminent Dutch Painters of the Seventeenth Century, vol 1. 1907. ""Johannes Vermeer.""","H.d.G. 23, 24, or 25","B. 29; H. 32; National Gallery, London, 1906 catalogue, no. 1383",,
https://www.nationalgallery.org.uk/paintings/johannes-vermeer-a-young-woman-seated-at-a-virginal,Vermeer  Johannes  1632-1675,Young Woman Seated at a Virginal,Attributed to Vermeer,"Gowing 1970, pp. 155-57; Blankert 1978, p. 59 and no. 31; Slatkes 1981, pp. 91-92; Wheelock 1981, p. 154; MacLaren/Brown 1991, pp. 468-69; Nash 1991, pp. 114-16; Washington and The Hague 1995-96, no. 22; Liedtke 2000, pp. 257-60, 294 n. 252; New York and London 2001, no. 79",,Burger 30; HdG 25; De Vries 31: after 1670; Bloch: pendant of cat. 25; Goldscheider 36: 1671,"Th. B. no. 30; H. no. 33; HdG. No. 25; Pl. no. 17; P. Alfassa, Les Vermeers de la Galerie  Nationale de Londres, in: La Revue de l'Art ancien et moderne, XX, 1911, p. 401-408","Th. B. no. 30; H. no. 33; H.d.G. no. 25; Pl. no. 23; P. Alfassa, Les Vermeers de la Galerie Nationale de Londres, Rev. Art. Anc., 1911, p. 401-8","Thore-Burger, Theophile, ""Van der Meer de Delft,"" in Gazette des Beaux-Arts 21 (October-December 1866); Groot, Hofstede de, A Catalogue Raisonee of the works of the Most Eminent Dutch Painters of the Seventeenth Century, vol 1. 1907. ""Johannes Vermeer."" ","H.d.G. 23, 24, or 25","B. 30; H. 33; Groot cites Parthey (ii. 98); Ch. Sedelmeyer, ""Catalogue of 300 Paintings,"" 1898, No. 85",,
https://www.english-heritage.org.uk/visit/places/kenwood/history-stories-kenwood/history/collections/,Vermeer  Johannes  1632-1675,The Guitar Player,Attributed to Vermeer,"Swillen 1950, pp. 154-55; Gowing 1970, pp. 20, 53, 55-56, 155-56; Blankert 1978, pp. 56-57 and no. 28; Slatkes 1981, p. 102; Wheelock 1981, p. 150; Montias 1989, pp. 197, 217, 260 n. 54; Wheelock 1995a, ch. 15; Washington and The Hague 1995-96, pp. 31, 47; Costaras 1998, pp. 148-50, 166-167; Weber 1998, pp. 295, 297; Goodman 2001, pp. 79-82; New York and London 2001, pp. 86, 151",,HdG 26; De Vries 26: 1667; Bloch: 1665-70; Goldscheider 32: 1670,"Th. B. no. 28 (?); H. no. 32 (?); HdG. No. 26 (?); Pl. no. 18; R.R. Tatlock, Old master exhibition at Messrs. Agnew, in: B.M., XLII, 1923, p. 54; Apollo, Vii, 1928, p. 6s; The Art News, XXVI, 1928, no. 16 et 18; The Studio, XCV, 1928, p. 161 et 166; Emil Waldmann, Die Bildersammlung des Earl of Iveagh in London, in: Der Cicerone, XX, 1928, p. 564; R.R. Tatlock, Vermeer's Guitar Player, in: B.M., LII, 1928, p. 41-42; Eduard Trautscholdt, Vermeer's Guitar Player, in: B.M., LII , 1928, p. 156","Th. B. no. 28?; H. no. 32? R. R. Tatlock, Vermeer's Guitarplayer, Burl. Mag. 1928, p. 41-42; Ed. Trautscholdt, l.c., p. 156","Groot, Hofstede de, A Catalogue Raisonee of the works of the Most Eminent Dutch Painters of the Seventeenth Century, vol 1. 1907. ""Johannes Vermeer.""; A.C.R. Carter, Burlington Magazine, December 1927; Edward Trautscholdt, Burlington Magazine, March 1928; Hale cites quotes by Mr. R.R. Tatlock, editor of Burlington Magazine and Mr. Royal Cortissoz, as well as a letter dated February 28, 1936 written by Dr. W.R. Valentiner, Director of the Detroit Institute of Arts",,,,
https://www.theleidencollection.com/artwork/young-woman-seated-at-a-virginal/,Vermeer  Johannes  1632-1675,A Young Woman Seated at the Virginals,Attributed to Vermeer,"Hofstede de Groot 1907-27, vol. 1, pp. 592-93, no. 24; Hale 1913, p. 275, ill. opposite p. 144; De Vries 1939, p. 95, no. 43.; De Vries 1948, pp. 65, 98; Swillen 1950, pp. 63, 108, 154, no. 30; Goldscheider 1967, no. 33; Gowing 1970, p. 157; Wright 1976, pp. 15, 69; Wheelock 1981, p. 45; Duchting 1996, p. 176; Broos 1998, p. 27; Liedtke 2000, p. 294  n. 252; New York and London 2001, pp. 403, 406 n. 11; Sotheby's 2004, pp. 24-45, no. 8 (with extensive literature); Sheldon and Costaras 2006",,,"HdG. no. 24; Pl. no. 25; Ph. L. Hale, Jan Vermeer of Delft, nouv. Ed., London 1937, no. 34", H.d.G. no. 24; Pl. no. 25,,"H.d.G. 23, 24, or 25",,,
https://commons.wikimedia.org/wiki/File:E._Boursse_Bellenblazers.gif,"Boursse, Esaias 1631-1672",Boy blowing Soap-Bubbles,Formerly Attributed to Vermeer,,,,,,,,,,
https://www.mutualart.com/Artwork/Portrait-of-a-boy-in-a-white-shirt/B31CCD9A4F84009D,"Braij, Jan de 1627-1697 attributed to",Boy with White Shirt,Formerly Attributed to Vermeer,,,,,,,,,,
https://emuseum.hydecollection.org/objects/76/girl-with-blue-bow?ctx=25e40990-9faa-4ad0-bdf4-01712d39ff9c&idx=0,Vermeer Johannes 1632-1675 attributed to,Bust Portrait of a Young Girl,Formerly Attributed to Vermeer,,,,"T. Borneius, Old Masters at the Ver Meer Gallery, in: Burlington Magazine., LXVI, 1935, pp. 298-99; G. Isarlo, Vermeer a l'Exposition de Rotterdam, in: La Renaissance de l'Art, XVIII, 1935, p. 94-111; Ph. L. Hale, Jan Vermeer of Delft, new ed. London 1927, no. 37","T. Borenius, Old Masters at the Vermeer Gallery, Burl. Mag. 1935, p. 298-299","F. Davis, ""An Auctioned 'Ugly Duckling becomes a Swan: a Vermeer Revealed,"" Illustrated London News, April 20, 1935; T. Borneius, Burlington Magazine, June 1935; Hale cites writings dated September 27, 1935 by W.R. Valentiner",,,,
https://www.wikidata.org/wiki/Q20010850#/media/File:Pieter_de_Hooch_-_Soldiers_Playing_Cards_-_WGA11685.jpg,Hooch Pieter de 1629-1684,Card Players,Formerly Attributed to Vermeer,,,,,,"Groot, Hofstede de, A Catalogue Raisonee of the works of the Most Eminent Dutch Painters of the Seventeenth Century, vol 1. ""Pieter de Hooch."" pp. 548-49 (264)","Groot, Hofstede de, A Catalogue Raisonee of the works of the Most Eminent Dutch Painters of the Seventeenth Century, vol 1. ""Pieter de Hooch."" pp. 548-49 (264)","Thore-Burger, Theophile, ""Van der Meer de Delft,"" in Gazette des Beaux-Arts 21 (October-December 1866) p. 550 (12)",Havard cites the catalogue of the Smith Collection ,"Sale catalogue of van Cuyck, Paris, 1866; Catalogue of the Smith Collection, no. 26"
https://www.museumdefundatie.nl/en/explore-the-collection/object/?pagina=0&id=0&vervaardigers=&techniek=&datums=&query=van+meegeren,"Meegeren Han van, 1889-1947",Christ and the Adulteress ,Formerly Attributed to Vermeer,,,,,,,,,,
https://www.boijmans.nl/en/collection/artworks/101464/the-men-at-emmaus,"Meegeren Han van, 1889-1947",Christ at Emmaus,Formerly Attributed to Vermeer,,,,"A. Bredius, A new Vermeer, in: B.M., LXXI, 1937, p. 211; A. Bredius, Nog een woord over Vermeer's Emmausgangers, din: O.H., LV, 1938, p. 97-99; D. Hannema, in: Jaarsverslag Museum Boymans, Rotterdam 1937, p. 2 s.; In: The Art News, XXXVI, 193/38, p. 8; A. Feulner, Das Emmausbild von Vermeer, in: Z.f.K., VII, 1938, p. 345-47; H. Gersmon, Masterpieces of four centuries, 1400-1800, Boymans Mueum, Rotterdam, in: B.M., LXXXIII, 1938, p. 86; S. Mac Greevy, in: The Studio, CXVI, 1938, p. 265s.; A.M. Hammacher, De Emmausgangers van Johannes Vermeer en Rembrandt, in: BeeldendeKunst, August 1938; J.L.A.A.M. van Rijckevorsel, Vermeer en Caravaggio, in: Historia IV, 1938, p. 249s. and no special july 1938, p. 20-24; C. Veth, in: Maandblad voor Beeldende Kunsten, XV, 1938, p. 286-87; Lo Duca, Un nuovo Vermeer di Delft, in: Emporium, Weekblad, 1939; H. van Guldener, in: Holl. Weekblad, 2 December 1939; J.V.C. Hefting, in: De Delver, 1939; M. van Dantzing, Johannes Vermeer, de ""Emmausgangers"" en de Critici, Leiden-Amsterdam 1947","A. Bredius, A New Vermeer, Burl. Mag. 1937, p. 211; A. Bredius, Nog een voord over Vermeer's Emmausgangers, Out-Holland, 1938, p. 97-99; Adolf Feulner, Das Emmausbild von Vermeer, Zeitschr. F. Kunstgesch., 1938, p. 345-47; A.M. Hammacher, De Emmaugangers van Johannes Vermeer en Rembrandt, Beeldende Kunst, 1938, Speciaal Nummer, p. 20-24; A.B. de Vries, Noch einmal Vermeer und Caravaggio, Pantheon, 1938, p. 286-87.",,,,,
,Hooch Pieter de 1629-1684 attributed to,Concert Party of Four Persons,Formerly Attributed to Vermeer,,,,,,,,,Harvard cites M. Cremer and W. Burger,Personal letter of M. Cremer
,Vermeer Johannes 1632-1675 attributed to,Conversation Piece,Formerly Attributed to Vermeer,,,,,,"Bredius, A., Burlington Magazine, October 1932",,,,
https://rkd.nl/en/explore/images/record?query=Reyer+Jacobsz.+van+Blommendael&start=5,"Blommendael, Reyer Jacobsz. Van, 1628-1675","Diana and her nymphs, resting after the hunt",Formerly Attributed to Vermeer,,,,,,,,,,
https://rkd.nl/en/explore/images/record?query=Johannes+Natus&start=1,"Natus Johannes, 1658-1662",Drinking and Smoking Group at a Table at a Yard,Formerly Attributed to Vermeer,,,,,,,,,,
,Vermeer Johannes 1632-1675 attributed to,Disasterous Landscape,Formerly Attributed to Vermeer,,,,,,,,,,
"Due to the constraints of the CSV format, no image can be displayed. For more information on this image, contact photoarchive@frick.org.",Unknown Artist,Dutch Room,Formerly Attributed to Vermeer,,,,,,,,,,
,Vermeer Johannes 1632-1675 attributed to,Entrance to the Woods,Formerly Attributed to Vermeer,,,,,,,,,,
,Vermeer Johannes 1632-1675 attributed to,Entrance to the Woods,Formerly Attributed to Vermeer,,,,,,,,,,"Musée de Bâle, catalogue, 1862, no. 285 (as Jacob van Ruisdael)"
"http://www.akademiegalerie.at/de/Sammlung/Bildinformation/?image_name=77&active_image=20&GALLERY_ORDER=11,110,92,102,37,63,13,113,56,68,70,60,93,16,89,23,79,64,28,20,77,6,74,87,98,12,42,59,49,4,33,10,26,46,84,15,100,91,78,88,83,47,94,104,22,31,107,96,44,35,108,43,19,40,66,36,53,9,24,82,55,30,67,97,14,32,95,85,7,106,111,112,90,86,65,51,21,99,17,27,80,2,18,61,81,50,103,75,45,58,105,73,39,1,38,57,54,5,101,71,3,52,34,72,76,109,69,48,41,25,29,62,8&mode=28&ART_Name=0&&ARTIST_Name=&GENRE_Name=&opener=http://www.akademiegalerie.at/de/Sammlung/Virtuelle%20Galerie/&final=",Hooch Pieter de 1629-1684,Family in the Courtyard of a House,Formerly Attributed to Vermeer,,,,,,"Groot, Hofstede de, A Catalogue Raisonee of the works of the Most Eminent Dutch Painters of the Seventeenth Century, vol 1. ""Pieter de Hooch."" pp. 565-66 (321)","Groot, Hofstede de, A Catalogue Raisonee of the works of the Most Eminent Dutch Painters of the Seventeenth Century, vol 1. ""Pieter de Hooch."" pp. 565-66 (321)","Long ascribed in error to J. Vermeer by Erasm. Engert, Waagen, and Burger (Thore-Burger, Theophile, ""Van der Meer de Delft,"" in Gazette des Beaux-Arts 21 (October-December 1866). P. 550 (13))","M.W. Unger, ""La Gazette des Beaux-Arts, 1874, 2nd semestre""","M. Waggen, Manuel, t. III. p. 27; M. Suermondt is cited in the text withough bibliographic refernces"
https://www.pubhist.com/w15636,"Renesse, Constantijn van 1626-1680",Family Group ,Formerly Attributed to Vermeer,,,,,,,,,,"Gallery of Count Czernin, Vienna, catalogue, no. 60, as Rembrandt;  M. Suermondt cited in the text without bibliographic references"
https://rkd.nl/en/explore/images/record?query=Jacob+Martsen&start=2,"Martsen, Jacob 1580-after 1630 attributed to","Family Portrait Right ""Let the children come to me""",Formerly Attributed to Vermeer,,,,,,,,,,
,Vermeer Johannes 1632-1675 attributed to,The Field,Formerly Attributed to Vermeer,,,,,,,,,,
https://rkd.nl/en/explore/images/record?filters%5Bobjectcategorie%5D%5B0%5D=drawing&query=johannes+vermeer&start=4,"Anonymous Dutch School, 17th century",Figure Studies,Formerly Attributed to Vermeer,,,,,,,,,,
https://rkd.nl/en/explore/images/record?query=Olivier+van+Deuren&start=2,Deuren  Olivier van  1666-1714.,The Geographer,Formerly Attributed to Vermeer,,,,,,"M. Thore, Gazette des Beaux-Arts, April, 1864; Groot, Cornelis Hofstede de de. Jan Vermeer van Delft en Carel Fabritius. Amsterdam, Schltema and Holkema, 1907; Hale cites Dr. W.R. Valentier, Director of the Detroit Institute of Arts and R. W. Martin, Director of the Royal Gallery of Paintings",,B. 35; H. 38,,
http://www.essentialvermeer.com/fakes_thefts_school_of_delft_lost_sp/erroneously_attributed_vermeers_one.html#.XQeigYhKh3h,Unknown Immitator of Vermeer,Girl in a Blue Dress and Yellow Cloak,Formerly Attributed to Vermeer,,,,,,,,,,
"Due to the nature of CSV formating, no image can be provided here. Please contact photoarchive@frick.org",Vermeer  Johannes  1632-1675  copy of,"A Girl Reading a Letter, copy of",Formerly Attributed to Vermeer,,,,,,,,,,
,Vermeer Johannes 1632-1675 attributed to,Girl Pouring Wine,Formerly Attributed to Vermeer,,,,,,"Holmes, C.J., Burlington Magazine, July 1909",,,,
"Image can be found in The Burlington Magazine for Connoisseurs, Volume 15, page 247- https://books.google.com/books?id=3sw-AQAAMAAJ&pg=PR7&lpg=PR7&dq=sackville+gallery+girl+pouring+wine&source=bl&ots=Et7ZRbF9oj&sig=ACfU3U33TcWAm5DQ2dVLtxB5-geQVvtHcA&hl=en&sa=X&ved=2ahUKEwieg_6EmefiAhUPmeAKHaCTDp0Q6AEwBnoECAkQAQ#v=onepage&q=sackville%20gallery%20girl%20pouring%20wine&f=false","Burch,  Hendrick van der 1627-approximately 1666",A Graduation Ceremony at the University of Leyden about 1650,Formerly Attributed to Vermeer,,,,,,,,B. 47,,
https://upload.wikimedia.org/wikipedia/commons/2/2a/A_graduation_ceremony_at_Leiden_University_about_1650%2C_by_Hendrick_van_der_Burgh.jpg,Steen Jan 1685-1750,The Harpsichord Lesson,Formerly Attributed to Vermeer,,,,,,"Groot, Hofstede de, A Catalogue Raisonee of the works of the Most Eminent Dutch Painters of the Seventeenth Century, vol 1. ""Jan Steen."" p. 107 (412)","Groot, Hofstede de, A Catalogue Raisonee of the works of the Most Eminent Dutch Painters of the Seventeenth Century, vol 1. ""Jan Steen."" p. 107 (412)","Groot cited Charles Blanc and Waagen (ii. 227); Wallace collection, London, 1901 catalogue, No. 154",Harvard cites the catalogue of the Collection of Sir Richard Wallace,"Lord Hertford Collection, Manchester House, London, as Jan Steen"
https://rkd.nl/en/explore/images/record?query=The+Harpsichord+Lesson&start=0,Vermeer  Johannes  1632-1675  manner of  attributed to,Head of a Girl,Formerly Attributed to Vermeer,,,,,,,,,,
,Jongh Ludolf de 1616-1679 attributed to,The Huntsman's Rest,Formerly Attributed to Vermeer,,,,,,"Valentiner, W.R., Pieter de Hooch (in Klassiker der Kunst), New York, E. Weyhe, 1930",,,,
,"Vrel, Jacobus, 1654-1670",An Interior of a Beguine Convent,Formerly Attributed to Vermeer,,,,,,,,,,"Sale of Reydon, Amsterdam, 1827"
,Vermeer Johannes 1632-1675 attributed to,An Interior of a Beguine Convent,Formerly Attributed to Vermeer,,,,,,,,,,
"Due to the constraints of the CSV format, no image can be displayed. For more information on this image, contact photoarchive@frick.org.","Thomas, Gerard 1663-1720 manner/circle of","Interior with a Man feeling the Pulse of a Woman, a Dentist beyond",Formerly Attributed to Vermeer,,,,,,,,,,
https://www.philamuseum.org/collections/permanent/102333.html?mulR=1849596643|1,"Vrel, Jacobus, 1654-1670",An Interior of a Town,Formerly Attributed to Vermeer,,,,,,,,,,
https://en.wikipedia.org/wiki/Jacob_Vrel#/media/File:Vrel1.jpg,"Vrel, Jacobus, 1654-1670",An Interior of a Town,Formerly Attributed to Vermeer,,,,,,,,,,"Catalogue of the Gallery Hudtwalcker, p. 117"
https://upload.wikimedia.org/wikipedia/commons/0/04/Jesus_unter_den_Schriftgelehrten_von_Han_van_Meegeren.jpg,"Meegeren Han van, 1889-1947",Jesus Teaching in the Temple,Formerly Attributed to Vermeer,,,,,,,,,,
