,Vermeer Johannes 1632-1675 attributed to,A Lady making Lace,Lost Vermeer,,,,,,,,,,
,Vermeer Johannes 1632-1675 attributed to,"A Lady at the Spinet, with a Gentleman",Lost Vermeer,,,,,,,,B. 9; H. 11,,"Musée de la Hollande, t. II, p. 65"
,Vermeer Johannes 1632-1675 attributed to,A Landscape with Trees,Lost Vermeer,,,,,,,,,,
,Vermeer Johannes 1632-1675 attributed to,A Lady Writing,Lost Vermeer,,,,,,,,,,
,Vermeer Johannes 1632-1675 attributed to,The Love Letter,Lost Vermeer,,,,,,,,,,
,Vermeer Johannes 1632-1675 attributed to,A Man playing Music with a Lady in an Interior,Lost Vermeer,,,,,,,H.d.G. 30,H. 9,,
,Vermeer Johannes 1632-1675 attributed to,A Man Reading,Lost Vermeer,,,,,,,,,,
,Vermeer Johannes 1632-1675 attributed to,A Nun reading,Lost Vermeer,,,,,,,,,,
,Vermeer Johannes 1632-1675 attributed to,"The Oude Gracht in Haarlem, near Klein Hiligland",Lost Vermeer,,,,,,,,,,
,Vermeer Johannes 1632-1675 attributed to,Part of a Town with a View into an Entry,Lost Vermeer,,,,,,,,,,
,Vermeer Johannes 1632-1675 attributed to,A Picture of a Street,Lost Vermeer,,,,,,,,,,
,Vermeer Johannes 1632-1675 attributed to,A Picture of a Street,Lost Vermeer,,,,,,,,,,
,Vermeer Johannes 1632-1675 attributed to,Portrait of Vermeer,Lost Vermeer,,,,,,,,,,
,Vermeer Johannes 1632-1675 attributed to,Portrait of a Young Lady,Lost Vermeer,,,,,,,,,,
,Vermeer Johannes 1632-1675 attributed to,Portrait of a Young Man,Lost Vermeer,,,,,,,,,,
,Vermeer Johannes 1632-1675 attributed to,A Public Place at The Hague,Lost Vermeer,,,,,,,,,,
,Vermeer Johannes 1632-1675 attributed to,Scene in a Courtyard,Lost Vermeer,,,,,,,,,,
,Vermeer Johannes 1632-1675 attributed to,A Trooper and a Girl,Lost Vermeer,,,,,,,,,,
,Vermeer Johannes 1632-1675 attributed to,A View of some Houses,Lost Vermeer,,,,,,,H.d.G. 49,,,
,Vermeer Johannes 1632-1675 attributed to,View of a Street in Delft,Lost Vermeer,,,,,,,,,,
,Vermeer Johannes 1632-1675 attributed to,Woman and Boy sitting by the Fireside in a Room,Lost Vermeer,,,,,,,,,,
,Vermeer Johannes 1632-1675 attributed to,Woman and Child,Lost Vermeer,,,,,,,,,,
,Vermeer Johannes 1632-1675 attributed to,A Woman combing her Hair,Lost Vermeer,,,,,,,,B. 47,,"Sale Pieter de Blok, Amsterdam, 1832"
,Vermeer Johannes 1632-1675 attributed to,A Woman making Lace,Lost Vermeer,,,,,,,,,,
,Vermeer Johannes 1632-1675 attributed to,A Woman making Lace,Lost Vermeer,,,,,,,,,,
,Vermeer Johannes 1632-1675 attributed to,A Woman with Needlework on her Lap,Lost Vermeer,,,,,,,,,,
,Vermeer Johannes 1632-1675 attributed to,A Woman pairing Turnips,Lost Vermeer,,,,,,,,B. 19; H. 22,,"Sale catalogue of Brentano, Amsterdam, 1822, no. 209"
,Vermeer Johannes 1632-1675 attributed to,A Woman washing a Boy's Head in a Room,Lost Vermeer,,,,,,,,,,
,Vermeer Johannes 1632-1675 attributed to,A Woman weighing Gold,Lost Vermeer,,,,,,,,B. 26,,"Sale of 1696, no. 1; Sale in Amsterdam, 1701; Catalogue of the Sale in La Haye, 1780, no. 97; Catalogue (by Henry), no. 130; Burger cites M. Horsin"
,Vermeer Johannes 1632-1675 attributed to,A Woman at Work with a Child,Lost Vermeer,,,,,,,,B. 18; H. 21,,"Sale, Amsterdam, Roos Collection, 1841, as van der Meer van Delft"
,Vermeer Johannes 1632-1675 attributed to,A Young Girl conversing with a Doctor,Lost Vermeer,,,,,,,,B. 22; H. 25,,"Sale catalogue of J. Hulswit, Amsterda, 1822"
,Vermeer Johannes 1632-1675 attributed to,A Young Woman skinning an Eel,Lost Vermeer,,,,,,,,,,
,Vermeer Johannes 1632-1675 attributed to,A Violent Storm at Sea,Lost Vermeer,,,,,,,,,,
